<?xml version="1.0" encoding="utf-8"?>
<!DOCTYPE keyboard SYSTEM 'VirtualKeyboardLayout.dtd'>
<keyboard version="1.0" catalog="symbols">
  <layout type="general">
    <section id="symbols0" type="non-sloppy">
      <row>
        <key>
          <binding label="&#x06F1;"/>
        </key>
        <key>
          <binding label="&#x06F2;"/>
        </key>
        <key>
          <binding label="&#x06F3;"/>
        </key>
        <key>
          <binding label="&#x06F4;"/>
        </key>
        <key>
          <binding label="&#x06F5;"/>
        </key>
        <key>
          <binding label="&#x06F6;"/>
        </key>
        <key>
          <binding label="&#x06F7;"/>
        </key>
        <key>
          <binding label="&#x06F8;"/>
        </key>
        <key>
          <binding label="&#x06F9;"/>
        </key>
        <key>
          <binding label="&#x06F0;"/>
        </key>
        <key>
          <binding label="٪"/>
        </key>
      </row>

      <row>
        <key>
          <binding label="*"/>
        </key>
        <key>
          <binding label="#"/>
        </key>
        <key>
          <binding label="+"/>
        </key>
        <key>
          <binding label="-"/>
        </key>
        <key>
          <binding label="_"/>
        </key>
        <key>
          <binding label="="/>
        </key>
        <key>
          <binding label="&#x0026;"/>
        </key>
        <key>
          <binding label=")" rtl="true"/>
        </key>
        <key>
          <binding label="(" rtl="true"/>
        </key>
        <key>
          <binding label="&gt;" rtl="true"/>
        </key>
        <key>
          <binding label="&lt;" rtl="true"/>
        </key>
      </row>

      <row>
        <key style="special">
          <binding action="switch" label="&#x0662;/&#x0661;"/>
        </key>
        <key>
          <binding label="@" quickpick="true"/>
        </key>
        <key>
          <binding label="~"/>
        </key>
        <key>
          <binding label="/"/>
        </key>
        <key>
          <binding label="\"/>
        </key>
        <key>
          <binding label="&#x0027;" quickpick="true"/>
        </key>
        <key>
          <binding label="&#x066B;"/>
        </key>
        <key>
          <binding label="&#x066C;"/>
        </key>
        <key>
          <binding label="!"/>
        </key>
        <key>
          <binding label="&#x061F;"/>
        </key>
        
        <key style="special">
          <binding action="backspace"/>
        </key>
      </row>

      <row>
        <key style="special" width="x-large">
          <binding action="sym" label="&#x0627;&#x200C;&#x0628;&#x200C;&#x067E;"/>
        </key>
        <key><binding label="&#x061B;"/></key>
        <key><binding label="&#x060C;"/></key>
        
        <key width="stretched">
          <binding action="space"/>
        </key>
        
        <key><binding label="&#x002E;"/></key>
        <key><binding label="&#x003A;"/></key>
        
        <key style="special" width="xx-large" id="actionKey">
          <binding action="return"/>
        </key>

      </row>
    </section>

    <section id="symbols1" type="non-sloppy">
      <row>
        <key>
          <binding label="1"/>
        </key>
        <key>
          <binding label="2"/>
        </key>
        <key>
          <binding label="3"/>
        </key>
        <key>
          <binding label="4"/>
        </key>
        <key>
          <binding label="5"/>
        </key>
        <key>
          <binding label="6"/>
        </key>
        <key>
          <binding label="7"/>
        </key>
        <key>
          <binding label="8"/>
        </key>
        <key>
          <binding label="9"/>
        </key>
        <key>
          <binding label="0"/>
        </key>
        <key>
          <binding label="%"/>
        </key>
      </row>

      <row>
        <key>
          <binding label="€"/>
        </key>
        <key>
          <binding label="£"/>
        </key>
        <key>
          <binding label="$"/>
        </key>
        <key>
          <binding label="¥"/>
        </key>
        <key>
          <binding label="&#1585;&#1740;&#1575;&#1604;" rtl="true"/>
        </key>
        <key>
          <binding label="&#x007D;" rtl="true"/>
        </key>
        <key>
          <binding label="&#x007B;" rtl="true"/>
        </key>
        <key>
          <binding label="&#x005D;" rtl="true"/>
        </key>
        <key>
          <binding label="&#x005B;" rtl="true"/>
        </key>
        <key>
          <binding label="&#x00BB;" rtl="true"/>
        </key>
        <key>
          <binding label="&#x00AB;" rtl="true"/>
        </key>
      </row>

      <row>
        <key style="special">
          <binding action="switch" label="&#x0662;/&#x0662;"/>
        </key>
        <key>
          <binding label="&#x0060;"/>
        </key>
        <key>
          <binding label="&#x005E;"/>
        </key>
        <key>
          <binding label="&#x007C;"/>
        </key>
        <key>
          <binding label="‰"/>
        </key>
        <key>
          <binding label="&#x0022;"/>
        </key>
        <key>
          <binding label="&#x201C;"/>
        </key>
        <key>
          <binding label="&#x201D;"/>
        </key>
        <key>
          <binding label="&#x201E;"/>
        </key>
        <key>
          <binding label="?"/>
        </key>

        <key style="special">
          <binding action="backspace"/>
        </key>
      </row>

      <row>
        <key style="special" width="x-large">
          <binding action="sym" label="&#x0627;&#x200C;&#x0628;&#x200C;&#x067E;"/>
        </key>
        
        <key><binding label=";"/></key>
        <key><binding label="&#x002C;"/></key>
        
        <key width="stretched">
          <binding action="space"/>
        </key>
	<key><binding label="."/></key>
        <key><binding label=":"/></key>
        
        <key style="special" width="xx-large" id="actionKey">
          <binding action="return"/>
        </key>
      </row>
    </section>
  </layout>
</keyboard>
