<?xml version="1.0" encoding="utf-8"?>
<!DOCTYPE keyboard SYSTEM 'VirtualKeyboardLayout.dtd'>
<keyboard title="Čeština" version="1.0" catalog="cs" language="cs">
  <layout type="general">
    <section id="main">
      <row>
        <key>
          <binding label="q"/>
          <binding shift="true" label="Q"/>
        </key>
        <key>
          <binding label="w"/>
          <binding shift="true" label="W"/>
        </key>
        <key>
          <binding extended_labels="ěéę€" accented_labels="éě" accents="´ˇ" label="e"/>
          <binding extended_labels="ĚÉĘ€" shift="true" accented_labels="ÉĚ" accents="´ˇ" label="E"/>
        </key>
        <key>
          <binding extended_labels="řŕ" accented_labels="ř" accents="ˇ" label="r"/>
          <binding extended_labels="ŘŔ" shift="true" accented_labels="Ř" accents="ˇ" label="R"/>
        </key>
        <key>
          <binding extended_labels="ťţ" accented_labels="ť" accents="ˇ" label="t"/>
          <binding extended_labels="ŤŢ" shift="true" accented_labels="Ť" accents="ˇ" label="T"/>
        </key>
        <key>
          <binding extended_labels="žźż" accented_labels="ž" accents="ˇ" label="z"/>
          <binding extended_labels="ŽŹŻ" shift="true" accented_labels="Ž" accents="ˇ" label="Z"/>
        </key>
        <key>
          <binding extended_labels="ůúüűùû" accented_labels="ú" accents="´" label="u"/>
          <binding extended_labels="ŮÚÜŰÙÛ" shift="true" accented_labels="Ú" accents="´" label="U"/>
        </key>
        <key>
          <binding extended_labels="íî" accented_labels="í" accents="´" label="i"/>
          <binding extended_labels="ÍÎ" shift="true" accented_labels="Í" accents="´" label="I"/>
        </key>
        <key>
          <binding extended_labels="óöőô" accented_labels="ó" accents="´" label="o"/>
          <binding extended_labels="ÓÖŐÔ" shift="true" accented_labels="Ó" accents="´" label="O"/>
        </key>
        <key>
          <binding label="p"/>
          <binding shift="true" label="P"/>
        </key>
      </row>

      <row>
        <key>
          <binding extended_labels="áäăâą" accented_labels="á" accents="´" label="a"/>
          <binding extended_labels="ÁÄĂÂĄ" shift="true" accented_labels="Á" accents="´" label="A"/>
        </key>
        <key>
          <binding extended_labels="šßśş$" accented_labels="š" accents="ˇ" label="s"/>
          <binding extended_labels="ŠŚŞ$" shift="true" accented_labels="Š" accents="ˇ" label="S"/>
        </key>
        <key>
          <binding extended_labels="ďđ" accented_labels="ď" accents="ˇ" label="d"/>
          <binding extended_labels="ĎĐ" shift="true" accented_labels="Ď" accents="ˇ" label="D"/>
        </key>
        <key>
          <binding label="f"/>
          <binding shift="true" label="F"/>
        </key>
        <key>
          <binding label="g"/>
          <binding shift="true" label="G"/>
        </key>
        <key>
          <binding label="h"/>
          <binding shift="true" label="H"/>
        </key>
        <key>
          <binding label="j"/>
          <binding shift="true" label="J"/>
        </key>
        <key>
          <binding label="k"/>
          <binding shift="true" label="K"/>
        </key>
        <key>
          <binding extended_labels="ľĺł" label="l"/>
          <binding extended_labels="ĽĹŁ" shift="true" label="L"/>
        </key>
		<key style="special">
            <binding dead="true" label="´"/>
        </key>
      </row>

      <row>
        <key style="special" width="x-large">
          <binding action="shift" label=""/>
        </key>

        <key>
          <binding extended_labels="ý¥" accented_labels="ý" accents="´" label="y"/>
          <binding extended_labels="Ý¥" shift="true" accented_labels="Ý" accents="´" label="Y"/>
        </key>
        <key>
          <binding label="x"/>
          <binding shift="true" label="X"/>
        </key>
        <key>
          <binding extended_labels="čćç" accented_labels="č" accents="ˇ" label="c"/>
          <binding extended_labels="ČĆÇ" shift="true" accented_labels="Č" accents="ˇ" label="C"/>
        </key>
        <key>
          <binding label="v"/>
          <binding shift="true" label="V"/>
        </key>
        <key>
          <binding label="b"/>
          <binding shift="true" label="B"/>
        </key>
        <key>
          <binding extended_labels="ňńñ" accented_labels="ň" accents="ˇ" label="n"/>
          <binding extended_labels="ŇŃÑ" shift="true" accented_labels="Ň" accents="ˇ" label="N"/>
        </key>
        <key>
          <binding label="m"/>
          <binding shift="true" label="M"/>
        </key>

        <key style="special" width="x-large">
          <binding action="backspace" label=""/>
        </key>
      </row>

      <row>
        <key style="special" width="x-large">
          <binding action="sym" label="?123"/>
        </key>

        <key style="special">
          <binding dead="true" label="ˇ"/>
        </key>
        <key id="emailUrlKey"><binding label=","/></key>

        <key width="stretched">
          <binding action="space" label=""/>
        </key>

        <key><binding label="."/></key>

        <key style="special" width="xx-large" id="actionKey">
          <binding action="return" label=""/>
        </key>
      </row>

    </section>
  </layout>

  <import file="symbols-35.xml"/>
</keyboard>
