<?xml version="1.0" encoding="utf-8"?>
<!DOCTYPE keyboard SYSTEM 'VirtualKeyboardLayout.dtd'>
<keyboard version="1.0" title="العربية" language="ar" catalog="ar" autocapitalization="false">
  <layout type="general">
    <section id="main">
      <row>
        <key>
          <binding label="ض"/>
        </key>
        <key>
          <binding label="ص"/>
        </key>
        <key>
          <binding label="ث"/>
        </key>
        <key>
          <binding label="ق"/>
        </key>
        <key>
          <binding label="ف"/>
        </key>
        <key>
          <binding label="غ"/>
          <binding shift="true" label="إ"/>
        </key>
        <key>
          <binding label="ع"/>
        </key>
        <key>
          <binding label="ه"/>
        </key>
        <key>
          <binding label="خ"/>
        </key>
        <key>
          <binding label="ح"/>
        </key>
        <key>
          <binding label="ج"/>
        </key>
      </row>

      <row>
        <key>
          <binding label="ش"/>
        </key>
        <key>
          <binding label="س"/>
        </key>
        <key>
          <binding label="ي"/>
        </key>
        <key>
          <binding label="ب"/>
        </key>
        <key>
          <binding label="ل"/>
        </key>
        <key>
          <binding label="ا"/>
          <binding shift="true" label="أ"/>
        </key>
        <key>
          <binding label="ت"/>
        </key>
        <key>
          <binding label="ن"/>
        </key>
        <key>
          <binding label="م"/>
        </key>
        <key>
          <binding label="ك"/>
        </key>
        <key>
          <binding label="د"/>
        </key>
      </row>
	
      <row>
        <key style="special">
          <binding action="shift"/>
        </key>

        <key>
          <binding label="ئ"/>
        </key>
        <key>
          <binding label="ء"/>
        </key>
        <key>
          <binding label="ؤ"/>
        </key>
        <key>
          <binding label="ر"/>
        </key>
        <key>
          <binding label="ى"/>
          <binding shift="true" label="آ"/>
        </key>
        <key>
          <binding label="ة"/>
        </key>
        <key>
          <binding label="و"/>
        </key>
        <key>
          <binding label="ز"/>
        </key>
        <key>
          <binding label="ظ"/>
        </key>

        <key style="special" rtl="true">
          <binding action="backspace"/>
        </key>
      </row>

      <row>
        <key style="special" width="x-large">
          <binding action="sym" label="&#x061F;&#x0663;&#x0662;&#x0661;"/>
        </key>
        
        <key><binding label="ذ"/></key>
        <key id="emailUrlKey"><binding label="،"/></key>

        <key width="stretched">
          <binding action="space"/>
        </key>
        
        <key><binding label="."/></key>
        <key><binding label="ط"/></key>

        <key style="special" width="xx-large" rtl="false" id="actionKey">
          <binding action="return"/>
        </key>
      </row>
    </section>
  </layout>

  <import file="symbols_ar.xml"/>
</keyboard>
