<?xml version="1.0" encoding="utf-8"?>
<!DOCTYPE keyboard SYSTEM 'VirtualKeyboardLayout.dtd'>
<keyboard version="1.0" title="Phone Number" catalog="phonenumber">
  <layout type="phonenumber" orientation="landscape">
    <section id="main" movable="false">
      <row height="x-large">
        <key>
          <binding label="&#x06F1;"/>
        </key>
        <key>
          <binding label="&#x06F2;" secondary_label="abc"/>
        </key>
        <key>
          <binding label="&#x06F3;" secondary_label="def"/>
        </key>
        <key>
          <binding label="&#x06F4;" secondary_label="ghi"/>
        </key>
        <key>
          <binding label="&#x06F5;" secondary_label="jkl"/>
        </key>
        <key>
          <binding label="&#x06F6;" secondary_label="mno"/>
        </key>
        <key>
          <binding label="&#x06F7;" secondary_label="pqrs"/>
        </key>
        <key>
          <binding label="&#x06F8;" secondary_label="tuv"/>
        </key>
        <key>
          <binding label="&#x06F9;" secondary_label="wxyz"/>
        </key>
        <key>
          <binding label="&#x06F0;"/>
        </key>
      </row>

      <row>
        <spacer/>

        <key width="large">
          <binding label="&#x002A;&#x002B;" cycleset="&#x002A;&#x002B;p" action="cycle"/>
        </key>
        <key width="large">
          <binding label="&#x0023;"/>
        </key>
        <key style="special" width="large">
          <binding label="" action="backspace"/>
        </key>
        <key style="special" id="actionKey" width="large">
          <binding action="return"/>
        </key>
      </row>
    </section>
  </layout>

  <layout type="phonenumber" orientation="portrait">
    <section id="main" movable="false">
      <row>
        <key>
          <binding label="&#x06F1;"/>
        </key>
        <key>
          <binding label="&#x06F2;" secondary_label="abc"/>
        </key>
        <key>
          <binding label="&#x06F3;" secondary_label="def"/>
        </key>
      </row>

      <row> 
        <key>
          <binding label="&#x06F4;" secondary_label="ghi"/>
        </key>
        <key>
          <binding label="&#x06F5;" secondary_label="jkl"/>
        </key>
        <key>
          <binding label="&#x06F6;" secondary_label="mno"/>
        </key>
      </row>

      <row> 
        <key>
          <binding label="&#x06F7;" secondary_label="pqrs"/>
        </key>
        <key>
          <binding label="&#x06F8;" secondary_label="tuv"/>
        </key>
        <key>
          <binding label="&#x06F9;" secondary_label="wxyz"/>
        </key>
      </row>

      <row> 
        <key>
          <binding label="&#x002A;&#x002B;" cycleset="&#x002A;&#x002B;p" action="cycle"/>
        </key>
        <key>
          <binding label="&#x06F0;"/>
        </key>
        <key>
          <binding label="&#x0023;"/>
        </key>
      </row>

      <row>
        <key style="special" width="large">
          <binding label="" action="backspace"/>
        </key>
        <spacer/>
        <key style="special" id="actionKey">
          <binding action="return"/>
        </key>
      </row>
    </section>
  </layout>
</keyboard>
