<?xml version="1.0" encoding="utf-8"?>
<!DOCTYPE keyboard SYSTEM 'VirtualKeyboardLayout.dtd'>
<keyboard title="Magyar" version="1.0" catalog="hu" language="hu">
  <layout type="general">
    <section id="main">
      <row>
       <key>
        <binding label="q"/>
        <binding shift="true" label="Q"/>
       </key>
       <key>
        <binding label="w"/>
        <binding shift="true" label="W"/>
       </key>
       <key>
        <binding accented_labels="é" accents="´" label="e" extended_labels="éęě€"/>
        <binding shift="true" accented_labels="É" accents="´" label="E" extended_labels="ÉĘĚ€"/>
       </key>
       <key>
        <binding label="r" extended_labels="ŕř"/>
        <binding shift="true" label="R" extended_labels="ŔŘ"/>
       </key>
       <key>
        <binding label="t" extended_labels="ţť"/>
        <binding shift="true" label="T" extended_labels="ŢŤ"/>
       </key>
       <key>
        <binding label="z" extended_labels="źżž"/>
        <binding shift="true" label="Z" extended_labels="ŹŻŽ"/>
       </key>
       <key>
        <binding accented_labels="úüű" accents="´¨˝" label="u" extended_labels="úüűů"/>
        <binding shift="true" accented_labels="ÚÜŰ" accents="´¨˝" label="U" extended_labels="ÚÜŰŮ"/>
       </key>
       <key>
        <binding accented_labels="í" accents="´" label="i" extended_labels="íî"/>
        <binding shift="true" accented_labels="Í" accents="´" label="I" extended_labels="ÍÎ"/>
       </key>
       <key>
        <binding accented_labels="óöő" accents="´¨˝" label="o" extended_labels="óöőô"/>
        <binding shift="true" accented_labels="ÓÖŐ" accents="´¨˝" label="O" extended_labels="ÓÖŐÔ"/>
       </key>
       <key>
        <binding label="p"/>
        <binding shift="true" label="P"/>
       </key>
      </row>

      <row>
       <key>
        <binding accented_labels="á" accents="´" label="a" extended_labels="áäâăą"/>
        <binding shift="true" accented_labels="Á" accents="´" label="A" extended_labels="ÁÄÂĂĄ"/>
       </key>
       <key>
        <binding label="s" extended_labels="ßśşš$"/>
        <binding shift="true" label="S" extended_labels="ŚŞŠ$"/>
       </key>
       <key>
        <binding label="d" extended_labels="đď"/>
        <binding shift="true" label="D" extended_labels="ĐĎ"/>
       </key>
       <key>
        <binding label="f"/>
        <binding shift="true" label="F"/>
       </key>
       <key>
        <binding label="g"/>
        <binding shift="true" label="G"/>
       </key>
       <key>
        <binding label="h"/>
        <binding shift="true" label="H"/>
       </key>
       <key>
        <binding label="j"/>
        <binding shift="true" label="J"/>
       </key>
       <key>
        <binding label="k"/>
        <binding shift="true" label="K"/>
       </key>
       <key>
        <binding label="l"/>
        <binding shift="true" label="L"/>
       </key>
       <key style="special">
        <binding dead="true" label="&#x00B4;"/>
       </key>
      </row>

      <row>
       <key style="special">
        <binding action="shift" label=""/>
       </key>

       <key>
        <binding label="y" extended_labels="¥"/>
        <binding shift="true" label="Y" extended_labels="¥"/>
       </key>
       <key>
        <binding label="x"/>
        <binding shift="true" label="X"/>
       </key>
       <key>
        <binding label="c" extended_labels="ćčç"/>
        <binding shift="true" label="C" extended_labels="ĆČÇ"/>
       </key>
       <key>
        <binding label="v"/>
        <binding shift="true" label="V"/>
       </key>
       <key>
        <binding label="b"/>
        <binding shift="true" label="B"/>
       </key>
       <key>
        <binding label="n" extended_labels="ńňñ"/>
        <binding shift="true" label="N" extended_labels="ŃŇÑ"/>
       </key>
       <key>
        <binding label="m"/>
        <binding shift="true" label="M"/>
       </key>
       <key style="special">
        <binding dead="true" label="&#x02DD;"/>
       </key>

       <key style="special">
        <binding action="backspace" label=""/>
       </key>
      </row>

      <row>
       <key style="special" width="large">
        <binding action="sym" label="?123"/>
       </key>

       <key style="special"><binding dead="true" label="¨"/></key>
       <key id="emailUrlKey"><binding label=","/></key>

       <key width="xx-large">
        <binding action="space" label=""/>
       </key>

       <key><binding label="."/></key>

       <key style="special" width="x-large" id="actionKey">
        <binding action="return" label=""/>
       </key>
      </row>
    </section>
  </layout>

  <import file="symbols-36.xml"/>
</keyboard>
