<?xml version="1.0" encoding="utf-8"?>
<!DOCTYPE keyboard SYSTEM 'VirtualKeyboardLayout.dtd'>
<keyboard title="Italiano" version="1.0" catalog="it" language="it">
  <layout type="general">
    <section id="main">
      <row>
        <key>
          <binding label="q"/>
          <binding shift="true" label="Q"/>
        </key>
        <key>
          <binding label="w"/>
          <binding shift="true" label="W"/>
        </key>
        <key>
          <binding accented_labels="è" accents="`" label="e" extended_labels="èéëê€"/>
          <binding shift="true" accented_labels="È" accents="`" label="E" extended_labels="ÈÉËÊ€"/>
        </key>
        <key>
          <binding label="r"/>
          <binding shift="true" label="R"/>
        </key>
        <key>
          <binding label="t"/>
          <binding shift="true" label="T"/>
        </key>
        <key>
          <binding label="y" extended_labels="¥"/>
          <binding shift="true" label="Y" extended_labels="¥"/>
        </key>
        <key>
          <binding accented_labels="ù" accents="`" label="u" extended_labels="ùüûú"/>
          <binding shift="true" accented_labels="Ù" accents="`" label="U" extended_labels="ÙÜÛÚ"/>
        </key>
        <key>
          <binding accented_labels="ì" accents="`" label="i" extended_labels="ìîïí"/>
          <binding shift="true" accented_labels="Ì" accents="`" label="I" extended_labels="ÌÎÏÍ"/>
        </key>
        <key>
          <binding accented_labels="ò" accents="`" label="o" extended_labels="òºóöôõø"/>
          <binding shift="true" accented_labels="Ò" accents="`" label="O" extended_labels="ÒºÓÖÔÕØ"/>
        </key>
        <key>
          <binding label="p"/>
          <binding shift="true" label="P"/>
        </key>
      </row>
      <row>
        <key>
          <binding accented_labels="à" accents="`" label="a" extended_labels="àªäáâã"/>
          <binding shift="true" accented_labels="À" accents="`" label="A" extended_labels="ÀªÄÁÂÃ"/>
        </key>
        <key>
          <binding label="s" extended_labels="ß$"/>
          <binding shift="true" label="S" extended_labels="$"/>
        </key>
        <key>
          <binding label="d"/>
          <binding shift="true" label="D"/>
        </key>
        <key>
          <binding label="f"/>
          <binding shift="true" label="F"/>
        </key>
        <key>
          <binding label="g"/>
          <binding shift="true" label="G"/>
        </key>
        <key>
          <binding label="h"/>
          <binding shift="true" label="H"/>
        </key>
        <key>
          <binding label="j"/>
          <binding shift="true" label="J"/>
        </key>
        <key>
          <binding label="k"/>
          <binding shift="true" label="K"/>
        </key>
        <key>
          <binding label="l"/>
          <binding shift="true" label="L"/>
        </key>
        <key><binding label="&#x0027;"/></key>
      </row>

      <row>
        <key style="special" width="x-large">
          <binding action="shift"/>
        </key>

        <key>
          <binding label="z"/>
          <binding shift="true" label="Z"/>
        </key>
        <key>
          <binding label="x"/>
          <binding shift="true" label="X"/>
        </key>
        <key>
          <binding label="c" extended_labels="ç"/>
          <binding shift="true" label="C" extended_labels="Ç"/>
        </key>
        <key>
          <binding label="v"/>
          <binding shift="true" label="V"/>
        </key>
        <key>
          <binding label="b"/>
          <binding shift="true" label="B"/>
        </key>
        <key>
          <binding label="n" extended_labels="ñ"/>
          <binding shift="true" label="N" extended_labels="Ñ"/>
        </key>
        <key>
          <binding label="m"/>
          <binding shift="true" label="M"/>
        </key>

        <key style="special" width="x-large">
          <binding action="backspace"/>
        </key>
      </row>

      <row>
        <key style="special" width="x-large">
          <binding action="sym" label="?123"/>
        </key>

        <key style="special">
          <binding dead="true" label="`"/>
        </key>
        <key id="emailUrlKey"><binding label=","/></key>

        <key width="stretched"><binding action="space"/></key>

        <key><binding label="."/></key>

        <key style="special" width="xx-large" id="actionKey">
          <binding action="return"/>
        </key>
      </row>
    </section>
  </layout>

  <import file="symbols-35.xml"/>
</keyboard>
