<?xml version="1.0" encoding="utf-8"?>
<!DOCTYPE keyboard SYSTEM 'VirtualKeyboardLayout.dtd'>
<keyboard title="Українська" version="1.0" catalog="" language="uk">
  <layout type="general">
    <section id="main">
      <row>
        <key>
          <binding label="й"/>
          <binding shift="true" label="Й"/>
        </key>
        <key>
          <binding label="ц"/>
          <binding shift="true" label="Ц"/>
        </key>
        <key>
          <binding label="у"/>
          <binding shift="true" label="У"/>
        </key>
        <key>
          <binding label="к"/>
          <binding shift="true" label="К"/>
        </key>
        <key>
          <binding label="е"/>
          <binding shift="true" label="Е"/>
        </key>
        <key>
          <binding label="н"/>
          <binding shift="true" label="Н"/>
        </key>
        <key>
          <binding label="г"/>
          <binding shift="true" label="Г"/>
        </key>
        <key>
          <binding label="ш"/>
          <binding shift="true" label="Ш"/>
        </key>
        <key>
          <binding label="щ"/>
          <binding shift="true" label="Щ"/>
        </key>
        <key>
          <binding label="з"/>
          <binding shift="true" label="З"/>
        </key>
        <key>
          <binding label="х"/>
          <binding shift="true" label="Х"/>
        </key>
      </row>

      <row>
        <key>
          <binding label="ф"/>
          <binding shift="true" label="Ф"/>
        </key>
        <key>
          <binding label="і"/>
          <binding shift="true" label="І"/>
        </key>
        <key>
          <binding label="в"/>
          <binding shift="true" label="В"/>
        </key>
        <key>
          <binding label="а"/>
          <binding shift="true" label="А"/>
        </key>
        <key>
          <binding label="п"/>
          <binding shift="true" label="П"/>
        </key>
        <key>
          <binding label="р"/>
          <binding shift="true" label="Р"/>
        </key>
        <key>
          <binding label="о"/>
          <binding shift="true" label="О"/>
        </key>
        <key>
          <binding label="л"/>
          <binding shift="true" label="Л"/>
        </key>
        <key>
          <binding label="д"/>
          <binding shift="true" label="Д"/>
        </key>
        <key>
          <binding label="ж"/>
          <binding shift="true" label="Ж"/>
        </key>
        <key>
          <binding label="є"/>
          <binding shift="true" label="Є"/>
        </key>
      </row>

      <row>
        <key style="special">
          <binding action="shift"/>
        </key>

        <key>
          <binding label="ґ"/>
          <binding shift="true" label="Ґ"/>
        </key>
        <key>
          <binding label="я"/>
          <binding shift="true" label="Я"/>
        </key>
        <key>
          <binding label="ч"/>
          <binding shift="true" label="Ч"/>
        </key>
        <key>
          <binding label="с"/>
          <binding shift="true" label="С"/>
        </key>
        <key>
          <binding label="м"/>
          <binding shift="true" label="М"/>
        </key>
        <key>
          <binding label="и"/>
          <binding shift="true" label="И"/>
        </key>
        <key>
          <binding label="т"/>
          <binding shift="true" label="Т"/>
        </key>
        <key>
          <binding label="ь"/>
          <binding shift="true" label="Ь"/>
        </key>
        <key>
          <binding label="б"/>
          <binding shift="true" label="Б"/>
        </key>

        <key style="special">
          <binding action="backspace"/>
        </key>
      </row>

      <row>
        <key style="special" width="large">
          <binding action="sym" label="?123"/>
        </key>

        <key>
          <binding label="ї"/>
          <binding shift="true" label="Ї"/>
        </key>
        <key id="emailUrlKey"><binding label=","/></key>

        <key width="xx-large">
          <binding action="space" label=""/>
        </key>

        <key><binding label="."/></key>
        <key>
          <binding label="ю"/>
          <binding shift="true" label="Ю"/>
        </key>

        <key style="special" width="x-large" id="actionKey">
          <binding action="return"/>
        </key>
      </row>
    </section>
  </layout>

  <import file="symbols_ru_uk.xml"/>
</keyboard>
