<?xml version="1.0" encoding="utf-8"?>
<!DOCTYPE keyboard SYSTEM 'VirtualKeyboardLayout.dtd'>
<keyboard title="Español" version="1.0" catalog="es" language="es">
  <layout type="general">
    <section id="main">
      <row>
      <key>
        <binding label="q"/>
        <binding shift="true" label="Q"/>
      </key>
      <key>
        <binding label="w"/>
        <binding shift="true" label="W"/>
      </key>
      <key>
        <binding accented_labels="éë" accents="´¨" label="e" extended_labels="éèêë€"/>
        <binding shift="true" accented_labels="ÉË" accents="´¨" label="E" extended_labels="ÉÈÊË€"/>
      </key>
      <key>
        <binding label="r"/>
        <binding shift="true" label="R"/>
      </key>
      <key>
        <binding label="t"/>
        <binding shift="true" label="T"/>
      </key>
      <key>
        <binding accented_labels="ÿ" accents="¨" label="y" extended_labels="¥"/>
        <binding shift="true" accented_labels="Ÿ" accents="¨" label="Y" extended_labels="¥"/>
      </key>
      <key>
        <binding accented_labels="úü" accents="´¨" label="u" extended_labels="úüùû"/>
        <binding shift="true" accented_labels="ÚÜ" accents="´¨" label="U" extended_labels="ÚÜÙÛ"/>
      </key>
      <key>
        <binding accented_labels="íï" accents="´¨" label="i" extended_labels="íïìî"/>
        <binding shift="true" accented_labels="ÍÏ" accents="´¨" label="I" extended_labels="ÍÏÌÎ"/>
      </key>
      <key>
        <binding accented_labels="óö" accents="´¨" label="o" extended_labels="óºöòôõ"/>
        <binding shift="true" accented_labels="ÓÖ" accents="´¨" label="O" extended_labels="ÓºÖÒÔÕ"/>
      </key>
      <key>
        <binding label="p"/>
        <binding shift="true" label="P"/>
      </key>
      </row>

      <row>
      <key>
        <binding accented_labels="áä" accents="´¨" label="a" extended_labels="áªäàâãæ"/>
        <binding shift="true" accented_labels="ÁÄ" accents="´¨" label="A" extended_labels="ÁªÄÀÂÃÆ"/>
      </key>
      <key>
        <binding label="s" extended_labels="ß$"/>
        <binding shift="true" label="S" extended_labels="$"/>
      </key>
      <key>
        <binding label="d"/>
        <binding shift="true" label="D"/>
      </key>
      <key>
        <binding label="f"/>
        <binding shift="true" label="F"/>
      </key>
      <key>
        <binding label="g"/>
        <binding shift="true" label="G"/>
      </key>
      <key>
        <binding label="h"/>
        <binding shift="true" label="H"/>
      </key>
      <key>
        <binding label="j"/>
        <binding shift="true" label="J"/>
      </key>
      <key>
        <binding label="k"/>
        <binding shift="true" label="K"/>
      </key>
      <key>
        <binding label="l" extended_labels="ŀ"/>
        <binding shift="true" label="L" extended_labels="Ŀ"/>
      </key>
      <key>
        <binding label="ñ"/>
        <binding shift="true" label="Ñ"/>
      </key>
      </row>

      <row>
      <key style="special" width="x-large">
        <binding action="shift" label=""/>
      </key>

      <key>
        <binding label="z"/>
        <binding shift="true" label="Z"/>
      </key>
      <key>
        <binding label="x"/>
        <binding shift="true" label="X"/>
      </key>
      <key>
        <binding label="c" extended_labels="ç"/>
        <binding shift="true" label="C" extended_labels="Ç"/>
      </key>
      <key>
        <binding label="v"/>
        <binding shift="true" label="V"/>
      </key>
      <key>
        <binding label="b"/>
        <binding shift="true" label="B"/>
      </key>
      <key>
        <binding label="n" extended_labels="ñ"/>
        <binding shift="true" label="N" extended_labels="Ñ"/>
      </key>
      <key>
        <binding label="m"/>
        <binding shift="true" label="M"/>
      </key>

      <key style="special" width="x-large">
        <binding action="backspace" label=""/>
      </key>
      
      </row>

      <row>
      <key style="special" width="x-large">
        <binding action="sym" label="?123"/>
      </key>

      <key style="special">
        <binding dead="true" label="´"/>
      </key>
      <key id="emailUrlKey"><binding label=","/></key>

      <key width="stretched">
        <binding action="space" label=""/>
      </key>

      <key><binding label="."/></key>

      <key style="special" width="xx-large" id="actionKey">
        <binding action="return" label=""/>
      </key>
      </row>
    </section>
  </layout>
  
  <import file="symbols-35.xml"/>
</keyboard>
