<?xml version="1.0" encoding="utf-8"?>
<!DOCTYPE keyboard SYSTEM 'VirtualKeyboardLayout.dtd'>
<keyboard title="Dansk" version="1.0" catalog="da" language="da">
  <layout type="general">
    <section id="main">
      <row>
      <key>
        <binding label="q"/>
        <binding shift="true" label="Q"/>
      </key>
      <key>
        <binding label="w"/>
        <binding shift="true" label="W"/>
      </key>
      <key>
        <binding label="e" extended_labels="éèëê€"/>
        <binding shift="true" label="E" extended_labels="ÉÈËÊ€"/>
      </key>
      <key>
        <binding label="r"/>
        <binding shift="true" label="R"/>
      </key>
      <key>
        <binding label="t" extended_labels="þ"/>
        <binding shift="true" label="T" extended_labels="Þ"/>
      </key>
      <key>
        <binding label="y" extended_labels="¥"/>
        <binding shift="true" label="Y" extended_labels="¥"/>
      </key>
      <key>
        <binding label="u" extended_labels="üùûú"/>
        <binding shift="true" label="U" extended_labels="ÜÙÛÚ"/>
      </key>
      <key>
        <binding label="i" extended_labels="îïìí"/>
        <binding shift="true" label="I" extended_labels="ÎÏÌÍ"/>
      </key>
      <key>
        <binding label="o" extended_labels="øöôòóõ"/>
        <binding shift="true" label="O" extended_labels="ØÖÔÒÓÕ"/>
      </key>
      <key>
        <binding label="p"/>
        <binding shift="true" label="P"/>
      </key>
      </row>

      <row>
      <key>
        <binding label="a" extended_labels="æåäàáâã"/>
        <binding shift="true" label="A" extended_labels="ÆÅÄÀÁÂÃ"/>
      </key>
      <key>
        <binding label="s" extended_labels="ß$"/>
        <binding shift="true" label="S" extended_labels="ß$"/>
      </key>
      <key>
        <binding label="d" extended_labels="ð"/>
        <binding shift="true" label="D" extended_labels="Ð"/>
      </key>
      <key>
        <binding label="f"/>
        <binding shift="true" label="F"/>
      </key>
      <key>
        <binding label="g"/>
        <binding shift="true" label="G"/>
      </key>
      <key>
        <binding label="h"/>
        <binding shift="true" label="H"/>
      </key>
      <key>
        <binding label="j"/>
        <binding shift="true" label="J"/>
      </key>
      <key>
        <binding label="k"/>
        <binding shift="true" label="K"/>
      </key>
      <key>
        <binding label="l"/>
        <binding shift="true" label="L"/>
      </key>
      <key>
        <binding label="å"/>
        <binding shift="true" label="Å"/>
      </key>
      </row>

      <row>
      <key style="special">
        <binding action="shift" label=""/>
      </key>

      <key>
        <binding label="z"/>
        <binding shift="true" label="Z"/>
      </key>
      <key>
        <binding label="x"/>
        <binding shift="true" label="X"/>
      </key>
      <key>
        <binding label="c" extended_labels="ç"/>
        <binding shift="true" label="C" extended_labels="Ç"/>
      </key>
      <key>
        <binding label="v"/>
        <binding shift="true" label="V"/>
      </key>
      <key>
        <binding label="b"/>
        <binding shift="true" label="B"/>
      </key>
      <key>
        <binding label="n" extended_labels="ñ"/>
        <binding shift="true" label="N" extended_labels="Ñ"/>
      </key>
      <key>
        <binding label="m"/>
        <binding shift="true" label="M"/>
      </key>
      <key>
        <binding label="æ" extended_labels="ä"/>
        <binding shift="true" label="Æ" extended_labels="Ä"/>
      </key>

      <key style="special">
        <binding action="backspace" label=""/>
      </key>
      </row>

      <row>
      <key style="special" width="large">
        <binding action="sym" label="?123"/>
      </key>

      <key id="emailUrlKey"><binding label=","/></key>
      <key><binding label="."/></key>

      <key width="xx-large">
        <binding action="space" label=""/>
      </key>

      <key>
        <binding label="ø" extended_labels="ö"/>
        <binding shift="true" label="Ø" extended_labels="Ö"/>
      </key>

      <key style="special" width="x-large" id="actionKey">
        <binding action="return" label=""/>
      </key>
    </row>
    </section>
  </layout>

  <import file="symbols-36-nordic.xml"/>
</keyboard>
