<?xml version="1.0" encoding="utf-8"?>
<!DOCTYPE keyboard SYSTEM 'VirtualKeyboardLayout.dtd'>
<keyboard version="1.0" title="Phone Number" catalog="phonenumber">
  <layout type="phonenumber" orientation="landscape">
    <section id="main" movable="false" >
      <row height="x-large">
        <key>
          <binding label="1"/>
        </key>
        <key>
          <binding label="2" secondary_label="&#x0430;&#x0431;&#x0432;&#x0433;"/>
        </key>
        <key>
          <binding label="3" secondary_label="&#x0434;&#x0435;&#x0436;&#x0437;"/>
        </key>
        <key>
          <binding label="4" secondary_label="&#x0438;&#x0439;&#x043A;&#x043B;"/>
        </key>
        <key>
          <binding label="5" secondary_label="&#x043C;&#x043D;&#x043E;&#x043F;"/>
        </key>
        <key>
          <binding label="6" secondary_label="&#x0440;&#x0441;&#x0442;&#x0443;"/>
        </key>
        <key>
          <binding label="7" secondary_label="&#x0444;&#x0445;&#x0446;&#x0447;"/>
        </key>
        <key>
          <binding label="8" secondary_label="&#x0448;&#x0449;&#x044A;&#x044B;"/>
        </key>
        <key>
          <binding label="9" secondary_label="&#x044C;&#x044D;&#x044E;&#x044F;"/>
        </key>
        <key>
          <binding label="0"/>
        </key>
      </row>

      <row>
        <spacer/>

        <key width="large">
          <binding label="&#x002A;&#x002B;" cycleset="&#x002A;&#x002B;p" action="cycle"/>
        </key>
        <key width="large">
          <binding label="&#x0023;"/>
        </key>
        <key style="special" width="large">
          <binding label="" action="backspace"/>
        </key>
        <key style="special" id="actionKey" width="large">
          <binding action="return"/>
        </key>
      </row>
    </section>
  </layout>

  <layout type="phonenumber" orientation="portrait">
    <section id="main" movable="false" >
      <row>
        <key>
          <binding label="1"/>
        </key>
        <key>
          <binding label="2" secondary_label="&#x0430;&#x0431;&#x0432;&#x0433;"/>
        </key>
        <key>
          <binding label="3" secondary_label="&#x0434;&#x0435;&#x0436;&#x0437;"/>
        </key>
      </row>

      <row>
        <key>
          <binding label="4" secondary_label="&#x0438;&#x0439;&#x043A;&#x043B;"/>
        </key>
        <key>
          <binding label="5" secondary_label="&#x043C;&#x043D;&#x043E;&#x043F;"/>
        </key>
        <key>
          <binding label="6" secondary_label="&#x0440;&#x0441;&#x0442;&#x0443;"/>
        </key>
      </row>

      <row>
        <key>
          <binding label="7" secondary_label="&#x0444;&#x0445;&#x0446;&#x0447;"/>
        </key>
        <key>
          <binding label="8" secondary_label="&#x0448;&#x0449;&#x044A;&#x044B;"/>
        </key>
        <key>
          <binding label="9" secondary_label="&#x044C;&#x044D;&#x044E;&#x044F;"/>
        </key>
      </row>

      <row>
        <key>
          <binding label="&#x002A;&#x002B;" cycleset="&#x002A;&#x002B;p" action="cycle"/>
        </key>
        <key>
          <binding label="0"/>
        </key>
        <key>
          <binding label="&#x0023;"/>
        </key>
      </row>

      <row>
        <key style="special" width="large">
          <binding label="" action="backspace"/>
        </key>
        <spacer/>
        <key style="special" id="actionKey">
          <binding action="return"/>
        </key>
      </row>
    </section>
  </layout>
</keyboard>
